"0";"This will replace the appearance of any back item and unlock the skin in your account wardrobe. 

This backpack skin has no stats of its own."
"1";"Unstable Bauble Refraction: Red"
"2";"Smash ten pieces of furniture in World 2, Zone 2 of Super Adventure Box."
"3";"This will replace the appearance of any back item and unlock the backpack skin and the glider in your account wardrobe.

This backpack skin has no stats of its own."
"4";"%str1%%str2%Soaring Torch%str3%%str4%"
"5";"Malicious White Mantle Pistol"
"6";"Infiltration and Extraction"
"7";"Double-click to choose an ascended orange Super Adventure Box weapon."
"8";"No Point Change (%str1%)"
